{
  "contractVersion": "loop1-reviewed-recommendation.v1",
  "issueNumber": 9601,
  "disposition": "develop independently",
  "suggestedArtifact": "prototype note",
  "primaryDomain": "Interfaces for Judgment",
  "themeOrCluster": "visible review boundaries",
  "rationale": "Fixture: sufficient explicit interaction grounding for a bounded prototype note.",
  "nextAction": "Draft a concise prototype note while preserving the unimplemented current-state boundary.",
  "humanApprovalStatus": "approved"
}
