{
  "contractVersion": "loop1-reviewed-recommendation.v1",
  "issueNumber": 9114,
  "disposition": "develop independently",
  "suggestedArtifact": "note",
  "primaryDomain": "Cognitive Infrastructure",
  "themeOrCluster": "verification capacity and institutional evidence",
  "rationale": "The conceptual argument is distinct, but its named report claim remains unresolved.",
  "nextAction": "Hold drafting until the explicitly identified report question is resolved.",
  "humanApprovalStatus": "approved"
}
