{
  "contractVersion": "loop1-reviewed-recommendation.v1",
  "issueNumber": 9112,
  "disposition": "research before development",
  "suggestedArtifact": "seed",
  "primaryDomain": "Institutions in Transition",
  "themeOrCluster": "public-service automation trust",
  "rationale": "Human review narrowed the research need to evidence from the municipal pilot.",
  "nextAction": "Verify the municipal survey dataset and compare documented trust outcomes with reported adoption rates.",
  "uncertaintyOrReviewFlag": "Confirm the survey sample and attribution before developing the note.",
  "humanApprovalStatus": "approved"
}
