{
  "contractVersion": "loop1-reviewed-recommendation.v1",
  "issueNumber": 9205,
  "disposition": "develop independently",
  "suggestedArtifact": "essay",
  "primaryDomain": "Human-Machine Workflows",
  "themeOrCluster": "unsupported",
  "rationale": "Fixture: unsupported artifact type.",
  "nextAction": "Should block.",
  "humanApprovalStatus": "approved"
}
