{
  "contractVersion": "loop1-reviewed-recommendation.v1",
  "issueNumber": 9107,
  "disposition": "combine with existing material",
  "suggestedArtifact": "note",
  "primaryDomain": "Interfaces for Judgment",
  "themeOrCluster": "disclosure and control",
  "rationale": "The conceptual distinction should strengthen an existing interface cluster without being represented as verified evidence.",
  "relatedMaterial": [
    {
      "reference": "#21",
      "note": "Existing cluster selected as the bounded fixture combine target."
    }
  ],
  "nextAction": "Carry the disclosure-versus-control distinction into the existing cluster.",
  "humanApprovalStatus": "approved"
}
