{
  "contractVersion": "loop1-reviewed-recommendation.v1",
  "issueNumber": 9116,
  "disposition": "develop independently",
  "suggestedArtifact": "note",
  "primaryDomain": "Human-Machine Workflows",
  "themeOrCluster": "bounded unrelated vocabulary",
  "rationale": "Approved distinction remains bounded.",
  "nextAction": "Draft a note.",
  "humanApprovalStatus": "approved"
}
