{
  "contractVersion": "loop1-reviewed-recommendation.v1",
  "issueNumber": 9812,
  "disposition": "develop independently",
  "suggestedArtifact": "note",
  "primaryDomain": "Cognitive Infrastructure",
  "themeOrCluster": "mental models for AI systems",
  "rationale": "The source supports a bounded distinction among model, interface, workflow, context, and person or relationship layer without relying on a verified market sequence.",
  "nextAction": "Draft a bounded note from the source material and preserve its supported open question.",
  "uncertaintyOrReviewFlag": "Treat chatbot, assistant, workspace, loop, and harness as a working model rather than a verified product sequence.",
  "humanApprovalStatus": "approved"
}
