{
  "contractVersion": "loop1-reviewed-recommendation.v1",
  "issueNumber": 17,
  "disposition": "develop independently",
  "suggestedArtifact": "prototype-note",
  "primaryDomain": "Interfaces for Judgment",
  "themeOrCluster": "supervision-interfaces",
  "rationale": "The issue specifies one proposed consumer control surface, its interaction groups, and permission states. That is a screen-level design artifact rather than a durable concept definition.",
  "nextAction": "Draft a bounded prototype-note that preserves the proposed-state boundary and exposes the grouped controls for human visual review.",
  "uncertaintyOrReviewFlag": "The source proposes a screen structure but does not establish that it has been built, tested, or observed in use.",
  "humanApprovalStatus": "approved",
  "reviewedAt": "2026-07-13T00:00:00-07:00",
  "reviewedBy": "human direction in issue-expansion task"
}
