{
  "contractVersion": "loop1-reviewed-recommendation.v1",
  "issueNumber": 9001,
  "disposition": "preserve as seed",
  "suggestedArtifact": "seed",
  "primaryDomain": "Human-Machine Workflows",
  "themeOrCluster": "fictional workflow boundaries",
  "rationale": "Fictional smoke-test material for Loop 2 packet generation without real backlog content.",
  "nextAction": "Use only for parser and schema smoke tests.",
  "humanApprovalStatus": "approved"
}
