{
  "contractVersion": "loop1-reviewed-recommendation.v1",
  "issueNumber": 9110,
  "disposition": "research before development",
  "suggestedArtifact": "seed",
  "primaryDomain": "Institutions in Transition",
  "themeOrCluster": "AI legitimacy and social acceptance",
  "rationale": "The adoption-versus-legitimacy distinction is distinct, but the public-opinion signal and institutional claims require verification.",
  "relatedMaterial": [
    {
      "reference": "src/content/articles/my-ai-rules.md",
      "note": "Related context, not a research source requirement."
    }
  ],
  "nextAction": "Verify the cited public-opinion findings and quotation context, then locate concrete institutional examples.",
  "uncertaintyOrReviewFlag": "Confirm whether the cited survey measures adoption, trust, or legitimacy.",
  "humanApprovalStatus": "approved"
}
