{
  "contractVersion": "loop1-reviewed-recommendation.v1",
  "issueNumber": 9113,
  "disposition": "develop independently",
  "suggestedArtifact": "note",
  "primaryDomain": "Cognitive Infrastructure",
  "themeOrCluster": "context inequality and judgment legibility",
  "rationale": "The source supports a bounded conceptual note about unequal context and review capacity without presenting the working model as an observed hierarchy.",
  "relatedMaterial": [
    {
      "reference": "src/content/field-notes/skills-half-life.md",
      "note": "Related durable-judgment context; not a combine target."
    },
    {
      "reference": "src/content/articles/my-ai-rules.md",
      "note": "Related permission and review context; not a combine target."
    }
  ],
  "nextAction": "Draft a bounded conceptual note that preserves the access-versus-context tension.",
  "humanApprovalStatus": "approved"
}
