{
  "contractVersion": "loop1-reviewed-recommendation.v1",
  "issueNumber": 9108,
  "disposition": "preserve as seed",
  "suggestedArtifact": "seed",
  "primaryDomain": "Human-Machine Workflows",
  "themeOrCluster": "capability versus expertise and review burden",
  "rationale": "The source has a distinct capability-versus-judgment tension. Issue #3 is neighboring context, not a combine target.",
  "relatedMaterial": [
    {
      "reference": "#3",
      "note": "Related management context, not a combine target."
    },
    {
      "reference": "src/content/field-notes/skills-half-life.md",
      "note": "Mature adjacent material about durable judgment; link rather than merge."
    }
  ],
  "nextAction": "Preserve this as a separate seed linked to Issue #3 and Skills half-life.",
  "humanApprovalStatus": "approved"
}
