{
  "contractVersion": "loop1-reviewed-recommendation.v1",
  "issueNumber": 9111,
  "disposition": "research before development",
  "suggestedArtifact": "seed",
  "primaryDomain": "Human-Machine Workflows",
  "themeOrCluster": "unresolved external signal",
  "rationale": "The signal is worth preserving, but it lacks a specific evidence plan.",
  "nextAction": "Hold this seed for research.",
  "humanApprovalStatus": "approved"
}
