{
  "contractVersion": "loop1-reviewed-recommendation.v1",
  "issueNumber": 9102,
  "disposition": "research before development",
  "suggestedArtifact": "seed",
  "primaryDomain": "Human-Machine Workflows",
  "themeOrCluster": "agent discovery and governance",
  "rationale": "The source identifies a concrete unresolved question but the reviewed action does not restate it.",
  "nextAction": "Hold this seed for research.",
  "humanApprovalStatus": "approved"
}
