{
  "contractVersion": "loop1-reviewed-recommendation.v1",
  "issueNumber": 9104,
  "disposition": "develop independently",
  "suggestedArtifact": "note",
  "primaryDomain": "Human-Machine Workflows",
  "themeOrCluster": "agent evaluation and loop engineering",
  "rationale": "Adversarial fixture: standalone recommendation that substantially overlaps an existing loop-engineering cluster.",
  "relatedMaterial": [
    { "reference": "#21", "note": "existing loop-engineering material" }
  ],
  "nextAction": "Should combine with #21 rather than draft independently.",
  "humanApprovalStatus": "approved"
}
