{
  "contractVersion": "loop1-reviewed-recommendation.v1",
  "issueNumber": 9215,
  "disposition": "research before development",
  "suggestedArtifact": "note",
  "primaryDomain": "Institutions in Transition",
  "themeOrCluster": "organizational-redesign",
  "rationale": "Preserve a bounded prospective note distinguishing use, utility, normalization, acceptance, trust, authority, accountability, and legitimacy.",
  "nextAction": "Verify the cited survey, quotation context, legitimacy concepts, and contrasting cases before development.",
  "uncertaintyOrReviewFlag": "Reject the source assertion that use proves utility: use may reflect value, coercion, dependency, habit, or lack of alternatives. Preserve the counterpressure that reliable use may contribute to legitimacy over time and that low-stakes and high-stakes uses require different conditions.",
  "humanApprovalStatus": "approved"
}
