{
  "contractVersion": "loop1-reviewed-recommendation.v1",
  "issueNumber": 9201,
  "disposition": "develop independently",
  "suggestedArtifact": "note",
  "primaryDomain": "Human-Machine Workflows",
  "themeOrCluster": "workflow judgment boundaries",
  "rationale": "Fixture: sufficient observation, tension, and bounded scope for a note draft.",
  "nextAction": "Outline a concise note with explicit observation, inference, and question sections.",
  "humanApprovalStatus": "approved"
}
